{
  "schema_version": "1.0",
  "run": {
    "id": "lexical-bm25-20260826090457",
    "created_at": "2026-08-26T09:04:57.388Z",
    "retriever": {
      "name": "bm25",
      "version": "1.0",
      "top_k": 10
    },
    "chunking": {
      "window_lines": 40,
      "overlap_lines": 10,
      "max_file_bytes": 524288
    },
    "provider_calls": 0,
    "cost_usd": 0,
    "content_execution": false
  },
  "sources": [
    {
      "id": "python-service",
      "revision": "fixture-v1",
      "root": "eval/fixtures/python-service",
      "file_count": 11,
      "chunk_count": 11,
      "indexed_bytes": 4714,
      "indexing_ms": 31.266
    },
    {
      "id": "typescript-service",
      "revision": "fixture-v1",
      "root": "eval/fixtures/typescript-service",
      "file_count": 10,
      "chunk_count": 10,
      "indexed_bytes": 4505,
      "indexing_ms": 30.792
    },
    {
      "id": "poetry",
      "revision": "5370f1397073fb885f2ad80816d03fc07c81c978",
      "root": "eval/cache/temp/intakes/poetry",
      "file_count": 920,
      "chunk_count": 4171,
      "indexed_bytes": 4202325,
      "indexing_ms": 1681.077
    },
    {
      "id": "uptime-kuma",
      "revision": "fcc51ebf4666121d18adbf09523b3aefda3576c9",
      "root": "eval/cache/temp/intakes/uptime-kuma",
      "file_count": 777,
      "chunk_count": 5157,
      "indexed_bytes": 7612650,
      "indexing_ms": 8482.677
    },
    {
      "id": "pocketbase",
      "revision": "bc8ffed4e7265a70a6e8de76c0b0b48b945e19ef",
      "root": "eval/cache/temp/intakes/pocketbase",
      "file_count": 797,
      "chunk_count": 6393,
      "indexed_bytes": 7236949,
      "indexing_ms": 6144.385
    },
    {
      "id": "security-content",
      "revision": "fixture-v1",
      "root": "eval/fixtures/security-content",
      "file_count": 2,
      "chunk_count": 2,
      "indexed_bytes": 2011,
      "indexing_ms": 3.278
    }
  ],
  "scenarios": [
    {
      "id": "py.entry-flow",
      "repository_id": "python-service",
      "expected_evidence": [
        {
          "path": "src/taskboard/api.py",
          "start_line": 16,
          "end_line": 21
        },
        {
          "path": "src/taskboard/domain.py",
          "start_line": 26,
          "end_line": 34
        }
      ],
      "retrieved_evidence": [
        {
          "path": "src/taskboard/api.py",
          "start_line": 1,
          "end_line": 22,
          "score": 3.23951085,
          "rank": 1
        },
        {
          "path": "src/taskboard/domain.py",
          "start_line": 1,
          "end_line": 35,
          "score": 2.37237001,
          "rank": 2
        },
        {
          "path": "src/taskboard/repository.py",
          "start_line": 1,
          "end_line": 16,
          "score": 2.34052677,
          "rank": 3
        },
        {
          "path": "README.md",
          "start_line": 1,
          "end_line": 9,
          "score": 1.6486772,
          "rank": 4
        },
        {
          "path": "LICENSE",
          "start_line": 1,
          "end_line": 22,
          "score": 1.0527563,
          "rank": 5
        }
      ],
      "retrieval_recall_at_10": 1,
      "retrieval_ms": 0.272
    },
    {
      "id": "py.input-validation",
      "repository_id": "python-service",
      "expected_evidence": [
        {
          "path": "src/taskboard/api.py",
          "start_line": 17,
          "end_line": 19
        },
        {
          "path": "src/taskboard/domain.py",
          "start_line": 26,
          "end_line": 29
        }
      ],
      "retrieved_evidence": [
        {
          "path": "src/taskboard/domain.py",
          "start_line": 1,
          "end_line": 35,
          "score": 2.37237001,
          "rank": 1
        },
        {
          "path": "src/taskboard/repository.py",
          "start_line": 1,
          "end_line": 16,
          "score": 2.34052677,
          "rank": 2
        },
        {
          "path": "src/taskboard/api.py",
          "start_line": 1,
          "end_line": 22,
          "score": 2.23560379,
          "rank": 3
        },
        {
          "path": "README.md",
          "start_line": 1,
          "end_line": 9,
          "score": 1.99915481,
          "rank": 4
        }
      ],
      "retrieval_recall_at_10": 1,
      "retrieval_ms": 0.042
    },
    {
      "id": "py.identifier",
      "repository_id": "python-service",
      "expected_evidence": [
        {
          "path": "src/taskboard/repository.py",
          "start_line": 11,
          "end_line": 12
        }
      ],
      "retrieved_evidence": [
        {
          "path": "README.md",
          "start_line": 1,
          "end_line": 9,
          "score": 5.76257095,
          "rank": 1
        },
        {
          "path": "src/taskboard/api.py",
          "start_line": 1,
          "end_line": 22,
          "score": 3.40194289,
          "rank": 2
        },
        {
          "path": "src/taskboard/repository.py",
          "start_line": 1,
          "end_line": 16,
          "score": 3.36457323,
          "rank": 3
        },
        {
          "path": "LICENSE",
          "start_line": 1,
          "end_line": 22,
          "score": 2.75524705,
          "rank": 4
        },
        {
          "path": "src/taskboard/domain.py",
          "start_line": 1,
          "end_line": 35,
          "score": 2.37237001,
          "rank": 5
        },
        {
          "path": ".env.example",
          "start_line": 1,
          "end_line": 3,
          "score": 1.56096827,
          "rank": 6
        },
        {
          "path": "pyproject.toml",
          "start_line": 1,
          "end_line": 8,
          "score": 1.33778877,
          "rank": 7
        },
        {
          "path": "src/taskboard/config.py",
          "start_line": 1,
          "end_line": 16,
          "score": 1.13988964,
          "rank": 8
        }
      ],
      "retrieval_recall_at_10": 1,
      "retrieval_ms": 0.039
    },
    {
      "id": "py.configuration",
      "repository_id": "python-service",
      "expected_evidence": [
        {
          "path": "src/taskboard/config.py",
          "start_line": 11,
          "end_line": 15
        },
        {
          "path": ".env.example",
          "start_line": 1,
          "end_line": 2
        }
      ],
      "retrieved_evidence": [
        {
          "path": "README.md",
          "start_line": 1,
          "end_line": 9,
          "score": 3.54501101,
          "rank": 1
        },
        {
          "path": "LICENSE",
          "start_line": 1,
          "end_line": 22,
          "score": 2.21286167,
          "rank": 2
        },
        {
          "path": "tests/test_ticket_flow.py",
          "start_line": 1,
          "end_line": 9,
          "score": 2.02377686,
          "rank": 3
        },
        {
          "path": "src/taskboard/api.py",
          "start_line": 1,
          "end_line": 22,
          "score": 1.73018307,
          "rank": 4
        },
        {
          "path": "src/taskboard/domain.py",
          "start_line": 1,
          "end_line": 35,
          "score": 0.90457544,
          "rank": 5
        }
      ],
      "retrieval_recall_at_10": 0,
      "retrieval_ms": 0.061
    },
    {
      "id": "py.dynamic-plugin",
      "repository_id": "python-service",
      "expected_evidence": [
        {
          "path": "src/taskboard/plugins.py",
          "start_line": 6,
          "end_line": 11
        }
      ],
      "retrieved_evidence": [
        {
          "path": "src/taskboard/api.py",
          "start_line": 1,
          "end_line": 22,
          "score": 2.63152515,
          "rank": 1
        },
        {
          "path": "src/taskboard/plugins.py",
          "start_line": 1,
          "end_line": 12,
          "score": 1.89556155,
          "rank": 2
        },
        {
          "path": "src/taskboard/domain.py",
          "start_line": 1,
          "end_line": 35,
          "score": 1.80814692,
          "rank": 3
        },
        {
          "path": "LICENSE",
          "start_line": 1,
          "end_line": 22,
          "score": 1.41500539,
          "rank": 4
        },
        {
          "path": "src/taskboard/repository.py",
          "start_line": 1,
          "end_line": 16,
          "score": 1.02404646,
          "rank": 5
        },
        {
          "path": "README.md",
          "start_line": 1,
          "end_line": 9,
          "score": 0.94295967,
          "rank": 6
        }
      ],
      "retrieval_recall_at_10": 1,
      "retrieval_ms": 0.033
    },
    {
      "id": "py.generated-exclusion",
      "repository_id": "python-service",
      "expected_evidence": [
        {
          "path": "generated/client.py",
          "start_line": 1,
          "end_line": 1
        }
      ],
      "retrieved_evidence": [
        {
          "path": "README.md",
          "start_line": 1,
          "end_line": 9,
          "score": 6.1258402,
          "rank": 1
        },
        {
          "path": "LICENSE",
          "start_line": 1,
          "end_line": 22,
          "score": 3.57018254,
          "rank": 2
        },
        {
          "path": "src/taskboard/api.py",
          "start_line": 1,
          "end_line": 22,
          "score": 2.17024615,
          "rank": 3
        },
        {
          "path": "src/taskboard/repository.py",
          "start_line": 1,
          "end_line": 16,
          "score": 1.02404646,
          "rank": 4
        }
      ],
      "retrieval_recall_at_10": 0,
      "retrieval_ms": 0.028
    },
    {
      "id": "py.test-contract",
      "repository_id": "python-service",
      "expected_evidence": [
        {
          "path": "tests/test_ticket_flow.py",
          "start_line": 4,
          "end_line": 8
        }
      ],
      "retrieved_evidence": [
        {
          "path": "README.md",
          "start_line": 1,
          "end_line": 9,
          "score": 3.89548862,
          "rank": 1
        },